<?xml version="1.0" encoding="UTF-8" ?>

<!--
	//////////////////////////////////////
	//	kraX						   	//
	//	Created by G4tw on 2012-02-29. 	//
	//////////////////////////////////////
-->
<roadCollection xmlns:xsi="http://www.w3.org/2001/XMLSchema-instance"
                xsi:noNamespaceSchemaLocation="kraX.xsd">

    <r>
        <n>Kruger</n>
        <s>130.0</s>
        <fx>5.0</fx>
        <fy>6.8</fy>
        <tx>10.1</tx>
        <ty>66.6</ty>
    </r>
    <r>
        <n>Kruger2</n>
        <s>30.0</s>
        <fx>10.1</fx>
        <fy>66.6</fy>
        <tx>150</tx>
        <ty>150</ty>
    </r>

</roadCollection>